{"bundleId":"621fed18-daff-46de-abf6-135b01c7a7b7","completeness":{"archivedRecordsExcluded":true,"assurance":"SIGNED_ASSERTION","scope":"MATCHING_RETAINED_LIVE_RECORDS","throughSeq":3,"upstreamCoverage":"NOT_PROVEN"},"exportedAt":"2030-02-03T04:05:06.123456Z","exportedBy":"auditor","format":"audit-export-bundle/v1","genesisHash":"24d21b9e759b10f48e0e355973846d9c5880e94cb26dfb10ccb466db6c940479","hashAlgorithm":"SHA-256","hashVersion":1,"headCheckpoint":{"chainHash":"61a1af4fae87ef1a46e1d5a47032d183ee892c151438a7c670f4115550b21110","createdAt":"2030-02-03T04:05:06.123456Z","keyId":"21fe31dfa154a261","seq":4,"signature":"zqFdgkhkNq9BHbSWUTRivdhb9xSrMrcPVCUDe5Z86Q0NcqHqrp2spOzTh7ReILWUI+lw8xXUS79kaZsZp2moAg=="},"ledgerId":"java-interop-ledger-é","purpose":"EXPORT","recordCount":2,"records":[{"actorId":"alice","chainHash":"6317550de5e81c214c786e35816a5b0e70d95f336e3c9e3c85787673a37fc367","contentHash":"3da00db1f4a0e36b5cf9ba8187e6e13f8fc02aac22ddcaa96600abf30c392503","disclosedLeaves":{"/big":{"salt":"9d1414230c92f80d5a72685cf0e7b1af5ca1f1fb2249dc6f2726e74c1730ff19","value":1e+21},"/double":{"salt":"3631e14b20212cb3d71e72a4cfdffa1f6226eedeb4307c9ce54a83f1a77a57b0","value":0.1},"/k~1~0/a/2":{"salt":"d44dea969842c4eaa89ae4c18efed093a78341b044fcced4be048e87066541dc","value":null},"/k~1~0/a/3":{"salt":"948ec247754d430469957cc95a1cf11dd57b2f5883de4d52d65788e1e3bc97c2","value":1.5},"/k~1~0/a/4":{"salt":"561efe59b4db05d725b2b7b4f7ecd56921a41189d225f902afbf2442c6671278","value":"x"},"/nothing":{"salt":"c27b212645f0fa3a04a35d253a79f90bc1758caf5fca5e7461da60e91990ac05","value":null},"/safeMax":{"salt":"c5ecb76cecb5a1a5f4e697aae411edbf140a7df28e6691f3ba8f1dc2b3295762","value":9007199254740991},"/text":{"salt":"cdee30685cc84c10dd2d5ef54667bc243642ccc5aaa62d2438d00fcb1d154b0b","value":"Zoë € 𝄞   tab\t"},"/tiny":{"salt":"a84c7140e604fc0d967bfd72165ddba7bdee0cba74e046604460491297f1280e","value":1e-7}},"eventId":"c5781eb6-27ac-4d3d-bad7-dcb5d03361cb","eventType":"NOTE","hashVersion":1,"occurredAt":null,"payloadCommitments":{"big":"0efc2ae159c69d7f0b4b0e9fda4c9805377c6006a6ead7fe781f9ab1d23fbbf6","double":"239432a38f2a3dc0fc369524ff6e7d2d9b0120f8969de3d16ab63034434b3ae5","emptyArray":[],"emptyObject":{},"k/~":{"a":[{},[],"10a0d84bbb161908392315ff968468e8b976dd8afec2316da6431618febff0ec","df78bcef857c36df76770d3bffedcb4d8c0ad004340892ecb7be0d8e57ec99d2","ae83d34baccbbc5a3d31e77bd7b22df53728220bda8157249ab3901c59e9789a"]},"nothing":"ebe4ae9c58190978207ac77b952c217ded6354c34c97be8a937193af8b2ad612","safeMax":"537c4e75b118ccdb584f82908d6fb6b3ac9af089e612cc9ccb4fa3f83f901408","text":"04ee99a5a89c8b11562dcb3bd0898ca8764104148030a8286ac56e1adb9af011","tiny":"5913695eacefb8f1d5139e462759729db99e1de6da49cb4b90c3acce25801940"},"prevHash":"24d21b9e759b10f48e0e355973846d9c5880e94cb26dfb10ccb466db6c940479","resourceId":"d1","resourceType":"DOC","seq":1,"source":"writer","timestamp":"2030-02-03T04:05:06.123456Z"},{"actorId":"alice","chainHash":"ed430767bd474bbb92b1827cdaa28e098faf5713522b1221e889f297d6f3ca41","contentHash":"2e5cfa0db397829c5e8f4626626f50780be262a1b290d8a7c0944076b84957be","disclosedLeaves":{"/k/0":{"salt":"50e2fc2b07d20d2ed7819123adb3d0ea6e211ba622fdee99d81a1e43170c9186","value":null}},"eventId":"7b93e766-9a8a-471c-9d86-a2068aac374f","eventType":"NOTE","hashVersion":1,"occurredAt":null,"payloadCommitments":{"k":["2a3ec57ba82c2398c3182c9b8f0f11abc1f7701ce2975d1334be45d54ebc96d3"]},"prevHash":"52753099a8b62c2bc8623a6ede96a0d7ba52b046a4a9afdbf99eee0ce0527eaf","resourceId":"d3","resourceType":"DOC","seq":3,"source":"writer","timestamp":"2030-02-03T04:05:06.123456Z"}],"recordsDigest":"f81baa378123bdfd1ed6b9cbc52b332f42662053f98715b3f04f8aa22caf89d2","selection":{"actorId":"alice","eventType":null,"from":null,"resourceId":null,"resourceType":null,"seqFrom":null,"seqTo":null,"to":null},"signature":"tGVNMe7nMfR0N4wWthcHD/PEk/cu553DWh5uXPn6jkgcaBWYFSLH5seyKS8gkoh/N9QhON6XlHROA9wG0F4kBg==","signatureAlgorithm":"Ed25519","signer":{"keyId":"21fe31dfa154a261","publicKey":"11qYAYKxCrfVS/7TyWQHOg7hcvPapiMlrwIaaPcHURo="}}