{"bundleId":"interop-bundle","completeness":{"archivedRecordsExcluded":true,"assurance":"SIGNED_ASSERTION","scope":"MATCHING_RETAINED_LIVE_RECORDS","throughSeq":5,"upstreamCoverage":"NOT_PROVEN"},"exportedAt":"2030-01-01T00:00:06.000000Z","exportedBy":"interop-auditor","format":"audit-export-bundle/v1","genesisHash":"6b4865e8ba1b2421fd68563372768de2ba7180ad052c53e00c3f2eacf306172d","hashAlgorithm":"SHA-256","hashVersion":1,"headCheckpoint":{"chainHash":"09d2384fdf13cecad735a71692b79fb5eed4ee4f801b72698ff314fca68c8c8f","createdAt":"2030-01-01T00:00:06.000000Z","keyId":"21fe31dfa154a261","seq":6,"signature":"iaSnMT/mIWULsNrGg4vGCrUyCFJMixm2yKw/s5IBBKjeAyML5+nqluslPfrJjDfFNi1LMNxwr9J0m9EjDI29Ag=="},"ledgerId":"interop-ledger-é","purpose":"EXPORT","recordCount":3,"records":[{"actorId":"alice","chainHash":"88f6e9380a71e6f5bd05796308826f40e0838ac12ea145305bd166ebff17764f","contentHash":"a2be447977fbcc8ce0cc2b6727a16fd13a7cbccd906b3e5ae33a9a6876b7802c","disclosedLeaves":{"/big":{"salt":"c5aff2c2de0581767d7e57e6aa6eb0bd15af0b53af3c14a7d742de73630670b5","value":1e+21},"/double":{"salt":"db750a9af01e4ccd0d187ce73bc7d477d91a0830b94002d378f860d683a21cd7","value":0.1},"/k~1~0/a/2":{"salt":"600e75a328ee8a4eb26403248b46029810269e3e953283a3891cff22193175e6","value":null},"/k~1~0/a/3":{"salt":"86478b6e2ad99fcc005348add4f19a01491e2ae60998f1d4be5ff826a2dc517c","value":1.5},"/k~1~0/a/4":{"salt":"11558b0dfcf3f56742acf3588e9f683191f93a8a9af75ddd2305eeb86f609c3a","value":"x"},"/negZero":{"salt":"d8a1cf829252623ccb26310eed0f4c29f252e992a8d9206efaed5b5554e7eed1","value":0},"/nothing":{"salt":"a26316fc7eb1bb6edc1f8a88b7debecba144f1e44fd079dcdecd94a1df2dac33","value":null},"/safeMax":{"salt":"80a89f3c40b365d01f20075867a1c91d3d55a2e1f4e1eabb3238ff031b1a1c5d","value":9007199254740991},"/text":{"salt":"642ccbb42b430dfc902c0b4307e42bff9a33ab7dbb65223b7f3a5ac13cc7551f","value":"Zoë € 𝄞   tab\t"},"/tiny":{"salt":"1e1a19283d57b450136fdb7a206ea6b3232516fee2f83bc39c73f15f387d9d08","value":1e-7}},"eventId":"00000000-0000-4000-8000-000000000001","eventType":"NOTE","hashVersion":1,"occurredAt":null,"payloadCommitments":{"big":"7e38047b577601d8502f8da211482f7bd67b88fe14504bbfe07dd795dfe69671","double":"5d41574daa1a02323b968fa38a520a9e8adf651cab099b259900e09c226dc603","emptyArray":[],"emptyObject":{},"k/~":{"a":[{},[],"5ae51654092102985576944900523925f85c31af54d116e85928750481c8f38e","9778f4ccdfcb81a44f142a436512c05431311b49b75ce9f8a3c4dcb068d6fc65","1c1f0a771a77fd858a6c179a94d3d40a87c7f733b829044b308b9bba87ad1157"]},"negZero":"33578c479534287fffda139cba82aaeba48848b61e930d84a03ac5f8b44847ea","nothing":"505d372390fd42ee3b26ae1d188222ae1767e264fe46ce95bb94bda5d94c551a","safeMax":"d826093dbec271dfb09eba995ff6c9bdde17d42d04a96aa8381a8a4330cf5070","text":"8a1fcd4f95a909c3fad06aa1931539ce25957949da78ee190b48a88a7ee787fe","tiny":"948ef2bca71200914e2349411e1882eb4b615b8745f49272c530f9cefc48f832"},"prevHash":"6b4865e8ba1b2421fd68563372768de2ba7180ad052c53e00c3f2eacf306172d","resourceId":"d1","resourceType":"DOC","seq":1,"source":"api:interop","timestamp":"2030-01-01T00:00:01.000000Z"},{"actorId":"alice","chainHash":"bf427886cf957ab59dcd0146ca79ca654eebbfb2cb1b04a9d4012c132a21f72d","contentHash":"54b52e242fb46eaaa256477f8b8bb121e46065e15d0de9f6fe2a93382ae56eea","disclosedLeaves":{},"eventId":"00000000-0000-4000-8000-000000000003","eventType":"NOTE","hashVersion":1,"occurredAt":null,"payloadCommitments":{"secret":"eef5061691a16490ba36651d5c1e397c1df450f1e02217fb7cbc0cea139efddb"},"prevHash":"619e0c82bef206ef6ee73271a73d5ed77e4f65145ba8272cf7ba25b2b3b2537a","resourceId":"d3","resourceType":"DOC","seq":3,"source":"api:interop","timestamp":"2030-01-01T00:00:03.000000Z"},{"actorId":"alice","chainHash":"95b360fdd448150b32aff212227d77435937f7858be290a5cba852b1f9cc3a79","contentHash":"e3e5cfbd8e1b45553d6f4121e29067bca23a8d4e8b44c965d876899aab1eb584","disclosedLeaves":{"/k/0":{"salt":"3f709c56ad11adee5f6e07a5c7618a9433af3d7eb42af5fbebfd4b9bcf1e4719","value":null}},"eventId":"00000000-0000-4000-8000-000000000004","eventType":"NOTE","hashVersion":1,"occurredAt":null,"payloadCommitments":{"k":["8829d2ac610e7295fe35a086f9747e37f76d5d22ecea90e910b6d50fb9f72264"]},"prevHash":"bf427886cf957ab59dcd0146ca79ca654eebbfb2cb1b04a9d4012c132a21f72d","resourceId":"d4","resourceType":"DOC","seq":4,"source":"api:interop","timestamp":"2030-01-01T00:00:04.000000Z"}],"recordsDigest":"dd9619a0ac0ac40ec2705bc63c3c87c8a990bbaa42b6c664ef5700cdde50ed4f","selection":{"actorId":"alice","eventType":null,"from":null,"resourceId":null,"resourceType":null,"seqFrom":null,"seqTo":null,"to":null},"signature":"LWc+w7QDIxASAgT/FjOQyyjhQp5HLff/944rmrfM5VJw6+aoa3IsY55PRyS9ZkF7P97phALLw+LnPotBjNkqCw==","signatureAlgorithm":"Ed25519","signer":{"keyId":"21fe31dfa154a261","publicKey":"11qYAYKxCrfVS/7TyWQHOg7hcvPapiMlrwIaaPcHURo="}}